{
  "schema_version": "clawboard.bridge.state.v1",
  "generated_at": "2026-03-23T10:05:01Z",
  "lobsters": [
    {
      "id": "lobster-a",
      "name": "分析龙虾 A",
      "status": "busy",
      "task_title": "客户报告生成",
      "last_active_at": "2026-03-23T10:05:00Z",
      "risk_level": "medium",
      "node_id": "node-sh-1",
      "recent_logs": [
        "runtime attached",
        "search finished",
        "waiting approval for crm_export"
      ]
    }
  ],
  "tasks": [
    {
      "id": "task-a",
      "title": "客户报告生成",
      "status": "waiting_approval",
      "progress": 72,
      "lobster_id": "lobster-a",
      "current_step": "crm_export",
      "risk_level": "high",
      "risk_score": 82,
      "input_summary": "生成客户组 A 周报",
      "output_summary": null,
      "error_reason": null,
      "timeline": [
        {
          "step": "plan",
          "status": "done"
        },
        {
          "step": "search",
          "status": "done"
        },
        {
          "step": "crm_export",
          "status": "waiting_approval"
        }
      ]
    }
  ],
  "approvals": [
    {
      "id": "approval-a",
      "task_id": "task-a",
      "lobster_id": "lobster-a",
      "title": "请求 CRM 导出权限",
      "reason": "生成完整客户报告",
      "scope": "客户组 A",
      "expires_at": "2026-03-23T10:30:00Z",
      "risk_level": "high",
      "status": "pending",
      "resolved_at": null,
      "resolution": null
    }
  ],
  "alerts": [
    {
      "id": "alert-a",
      "level": "P2",
      "title": "任务等待审批",
      "summary": "task-a 正在等待 CRM 导出审批",
      "related_type": "task",
      "related_id": "task-a"
    }
  ]
}